{
  "$schema": "https://mandolin.github.io/HIA-Documentation/schemas/hia-jsdoc-config-1.0.0.schema.json",
  "schemaVersion": "1.0.0",
  "workspaceRoot": ".",
  "outputDirectory": "dist/hia-jsdoc",
  "inputs": [
    {
      "kind": "javascript-source",
      "path": "src"
    }
  ],
  "options": {
    "mode": "both",
    "includePattern": ".+\\.js$",
    "writeResultManifest": true,
    "plugin": {
      "pluginPath": "../../node_modules/@mandolin/jsdoc-plugin-hia-sys/src/index.cjs"
    },
    "theme": {
      "template": "../../node_modules/@mandolin/jsdoc-theme-hia"
    },
    "hia": {
      "presentation": {
        "pageMode": "multi-page",
        "sourceMode": "fetch"
      },
      "i18n": {
        "enabled": true,
        "defaultLocale": "en",
        "fallbackLocale": "en",
        "locales": ["en", "zh-CN"]
      },
      "theme": {
        "skin": "classic",
        "scheme": "system",
        "code": {
          "fontFamily": "sarasa"
        }
      }
    }
  }
}
